id,book,chapter,verse,text,authentic
60001004,1 Peter,1,4,"To an inheritance incorruptible, and undefiled, and that fadeth not away, reserved in heaven for you,",False
59002025,James,2,25,"Likewise also was not Rahab the harlot justified by works, when she had received the messengers, and had sent them out another way?",False
60001005,1 Peter,1,5,Who are kept by the power of God through faith unto salvation ready to be revealed in the last time.,False
59001010,James,1,10,"But the rich, in that he is made low: because as the flower of the grass he shall pass away.",False
61002012,2 Peter,2,12,"But these, as natural brute beasts, made to be taken and destroyed, speak evil of the things that they understand not; and shall utterly perish in their own corruption;",False
59001017,James,1,17,"Every good gift and every perfect gift is from above, and cometh down from the Father of lights, with whom is no variableness, neither shadow of turning.",False
62003006,1 John,3,6,"Whosoever abideth in him sinneth not: whosoever sinneth hath not seen him, neither known him.",False
59001001,James,1,1,"James, a servant of God and of the Lord Jesus Christ, to the twelve tribes which are scattered abroad, greeting.",False
59005018,James,5,18,"And he prayed again, and the heaven gave rain, and the earth brought forth her fruit.",False
61001015,2 Peter,1,15,Moreover I will endeavour that ye may be able after my decease to have these things always in remembrance.,False
65001010,Jude,1,10,"But these speak evil of those things which they know not: but what they know naturally, as brute beasts, in those things they corrupt themselves.",False
62003022,1 John,3,22,"And whatsoever we ask, we receive of him, because we keep his commandments, and do those things that are pleasing in his sight.",False
62005007,1 John,5,7,"For there are three that bear record in heaven, the Father, the Word, and the Holy Ghost: and these three are one.",False
59003018,James,3,18,And the fruit of righteousness is sown in peace of them that make peace.,False
61003006,2 Peter,3,6,"Whereby the world that then was, being overflowed with water, perished:",False
59002012,James,2,12,"So speak ye, and so do, as they that shall be judged by the law of liberty.",False
60002018,1 Peter,2,18,"Servants, be subject to your masters with all fear; not only to the good and gentle, but also to the froward.",False
61002017,2 Peter,2,17,"These are wells without water, clouds that are carried with a tempest; to whom the mist of darkness is reserved for ever.",False
60003006,1 Peter,3,6,"Even as Sara obeyed Abraham, calling him lord: whose daughters ye are, as long as ye do well, and are not afraid with any amazement.",False
60003010,1 Peter,3,10,"For he that will love life, and see good days, let him refrain his tongue from evil, and his lips that they speak no guile:",False
62005012,1 John,5,12,He that hath the Son hath life; and he that hath not the Son of God hath not life.,False
64001014,3 John,1,14,"But I trust I shall shortly see thee, and we shall speak face to face. Peace be to thee. Our friends salute thee. Greet the friends by name.",False
61001021,2 Peter,1,21,For the prophecy came not in old time by the will of man: but holy men of God spake as they were moved by the Holy Ghost.,False
64001015,3 John,1,15,[],False
60002013,1 Peter,2,13,"Submit yourselves to every ordinance of man for the Lord's sake: whether it be to the king, as supreme;",False
61001013,2 Peter,1,13,"Yea, I think it meet, as long as I am in this tabernacle, to stir you up by putting you in remembrance;",False
62002013,1 John,2,13,"I write unto you, fathers, because ye have known him that is from the beginning. I write unto you, young men, because ye have overcome the wicked one. I write unto you, little children, because ye have known the Father.",False
59002016,James,2,16,"And one of you say unto them, Depart in peace, be ye warmed and filled; notwithstanding ye give them not those things which are needful to the body; what doth it profit?",False
60003003,1 Peter,3,3,"Whose adorning let it not be that outward adorning of plaiting the hair, and of wearing of gold, or of putting on of apparel;",False
62004010,1 John,4,10,"Herein is love, not that we loved God, but that he loved us, and sent his Son to be the propitiation for our sins.",False
61001017,2 Peter,1,17,"For he received from God the Father honour and glory, when there came such a voice to him from the excellent glory, This is my beloved Son, in whom I am well pleased.",False
65001017,Jude,1,17,"But, beloved, remember ye the words which were spoken before of the apostles of our Lord Jesus Christ;",False
65001024,Jude,1,24,"Now unto him that is able to keep you from falling, and to present you faultless before the presence of his glory with exceeding joy,",False
65001018,Jude,1,18,"How that they told you there should be mockers in the last time, who should walk after their own ungodly lusts.",False
62004009,1 John,4,9,"In this was manifested the love of God toward us, because that God sent his only begotten Son into the world, that we might live through him.",False
62004017,1 John,4,17,"Herein is our love made perfect, that we may have boldness in the day of judgment: because as he is, so are we in this world.",False
62002022,1 John,2,22,"Who is a liar but he that denieth that Jesus is the Christ? He is antichrist, that denieth the Father and the Son.",False
61001018,2 Peter,1,18,"And this voice which came from heaven we heard, when we were with him in the holy mount.",False
62005003,1 John,5,3,"For this is the love of God, that we keep his commandments: and his commandments are not grievous.",False
60002015,1 Peter,2,15,"For so is the will of God, that with well doing ye may put to silence the ignorance of foolish men:",False
64001001,3 John,1,1,"The elder unto the wellbeloved Gaius, whom I love in the truth.",False
59005013,James,5,13,Is any among you afflicted? let him pray. Is any merry? let him sing psalms.,False
59002008,James,2,8,"If ye fulfil the royal law according to the scripture, Thou shalt love thy neighbour as thyself, ye do well:",False
60004009,1 Peter,4,9,Use hospitality one to another without grudging.,False
60001003,1 Peter,1,3,"Blessed be the God and Father of our Lord Jesus Christ, which according to his abundant mercy hath begotten us again unto a lively hope by the resurrection of Jesus Christ from the dead,",False
60003018,1 Peter,3,18,"For Christ also hath once suffered for sins, the just for the unjust, that he might bring us to God, being put to death in the flesh, but quickened by the Spirit:",False
59003001,James,3,1,"My brethren, be not many masters, knowing that we shall receive the greater condemnation.",False
60002003,1 Peter,2,3,If so be ye have tasted that the Lord is gracious.,False
65001006,Jude,1,6,"And the angels which kept not their first estate, but left their own habitation, he hath reserved in everlasting chains under darkness unto the judgment of the great day.",False
60002022,1 Peter,2,22,"Who did no sin, neither was guile found in his mouth:",False
59001020,James,1,20,For the wrath of man worketh not the righteousness of God.,False
60002010,1 Peter,2,10,"Which in time past were not a people, but are now the people of God: which had not obtained mercy, but now have obtained mercy.",False
62005004,1 John,5,4,"For whatsoever is born of God overcometh the world: and this is the victory that overcometh the world, even our faith.",False
60003001,1 Peter,3,1,"Likewise, ye wives, be in subjection to your own husbands; that, if any obey not the word, they also may without the word be won by the conversation of the wives;",False
62002010,1 John,2,10,"He that loveth his brother abideth in the light, and there is none occasion of stumbling in him.",False
59002018,James,2,18,"Yea, a man may say, Thou hast faith, and I have works: shew me thy faith without thy works, and I will shew thee my faith by my works.",False
62002008,1 John,2,8,"Again, a new commandment I write unto you, which thing is true in him and in you: because the darkness is past, and the true light now shineth.",False
60001006,1 Peter,1,6,"Wherein ye greatly rejoice, though now for a season, if need be, ye are in heaviness through manifold temptations:",False
61003016,2 Peter,3,16,"As also in all his epistles, speaking in them of these things; in which are some things hard to be understood, which they that are unlearned and unstable wrest, as they do also the other scriptures, unto their own destruction.",False
60005013,1 Peter,5,13,"The church that is at Babylon, elected together with you, saluteth you; and so doth Marcus my son.",False
60001001,1 Peter,1,1,"Peter, an apostle of Jesus Christ, to the strangers scattered throughout Pontus, Galatia, Cappadocia, Asia, and Bithynia,",False
62005013,1 John,5,13,"These things have I written unto you that believe on the name of the Son of God; that ye may know that ye have eternal life, and that ye may believe on the name of the Son of God.",False
60003012,1 Peter,3,12,"For the eyes of the Lord are over the righteous, and his ears are open unto their prayers: but the face of the Lord is against them that do evil.",False
59004009,James,4,9,"Be afflicted, and mourn, and weep: let your laughter be turned to mourning, and your joy to heaviness.",False
65001001,Jude,1,1,"Jude, the servant of Jesus Christ, and brother of James, to them that are sanctified by God the Father, and preserved in Jesus Christ, and called:",False
61003018,2 Peter,3,18,"But grow in grace, and in the knowledge of our Lord and Saviour Jesus Christ. To him be glory both now and for ever. Amen.",False
59004014,James,4,14,"Whereas ye know not what shall be on the morrow. For what is your life? It is even a vapour, that appeareth for a little time, and then vanisheth away.",False
59001009,James,1,9,Let the brother of low degree rejoice in that he is exalted:,False
61002018,2 Peter,2,18,"For when they speak great swelling words of vanity, they allure through the lusts of the flesh, through much wantonness, those that were clean escaped from them who live in error.",False
59005012,James,5,12,"But above all things, my brethren, swear not, neither by heaven, neither by the earth, neither by any other oath: but let your yea be yea; and your nay, nay; lest ye fall into condemnation.",False
62005017,1 John,5,17,All unrighteousness is sin: and there is a sin not unto death.,False
64001012,3 John,1,12,"Demetrius hath good report of all men, and of the truth itself: yea, and we also bear record; and ye know that our record is true.",False
62004007,1 John,4,7,"Beloved, let us love one another: for love is of God; and every one that loveth is born of God, and knoweth God.",False
61001010,2 Peter,1,10,"Wherefore the rather, brethren, give diligence to make your calling and election sure: for if ye do these things, ye shall never fall:",False
59002002,James,2,2,"For if there come unto your assembly a man with a gold ring, in goodly apparel, and there come in also a poor man in vile raiment;",False
59002005,James,2,5,"Hearken, my beloved brethren, Hath not God chosen the poor of this world rich in faith, and heirs of the kingdom which he hath promised to them that love him?",False
62003003,1 John,3,3,"And every man that hath this hope in him purifieth himself, even as he is pure.",False
59003003,James,3,3,"Behold, we put bits in the horses' mouths, that they may obey us; and we turn about their whole body.",False
