id,text
51003011,"Where there is neither Greek nor Jew, circumcision nor uncircumcision, Barbarian, Scythian, bond nor free: but Christ is all, and in all."
51003012,"Put on therefore, as the elect of God, holy and beloved, bowels of mercies, kindness, humbleness of mind, meekness, longsuffering;"
51003013,"Forbearing one another, and forgiving one another, if any man have a quarrel against any: even as Christ forgave you, so also do ye."
51003014,"And above all these things put on charity, which is the bond of perfectness."
51003015,"And let the peace of God rule in your hearts, to the which also ye are called in one body; and be ye thankful."
51003016,"Let the word of Christ dwell in you richly in all wisdom; teaching and admonishing one another in psalms and hymns and spiritual songs, singing with grace in your hearts to the Lord."
51003017,"And whatsoever ye do in word or deed, do all in the name of the Lord Jesus, giving thanks to God and the Father by him."
51003018,"Wives, submit yourselves unto your own husbands, as it is fit in the Lord."
51003019,"Husbands, love your wives, and be not bitter against them."
51003020,"Children, obey your parents in all things: for this is well pleasing unto the Lord."
51003021,"Fathers, provoke not your children to anger, lest they be discouraged."
51003022,"Servants, obey in all things your masters according to the flesh; not with eyeservice, as menpleasers; but in singleness of heart, fearing God;"
51003023,"And whatsoever ye do, do it heartily, as to the Lord, and not unto men;"
51003024,Knowing that of the Lord ye shall receive the reward of the inheritance: for ye serve the Lord Christ.
51003025,But he that doeth wrong shall receive for the wrong which he hath done: and there is no respect of persons.
51004001,"Masters, give unto your servants that which is just and equal; knowing that ye also have a Master in heaven."
51004002,"Continue in prayer, and watch in the same with thanksgiving;"
51004003,"Withal praying also for us, that God would open unto us a door of utterance, to speak the mystery of Christ, for which I am also in bonds:"
51004004,"That I may make it manifest, as I ought to speak."
51004005,"Walk in wisdom toward them that are without, redeeming the time."
51004006,"Let your speech be alway with grace, seasoned with salt, that ye may know how ye ought to answer every man."
51004007,"All my state shall Tychicus declare unto you, who is a beloved brother, and a faithful minister and fellowservant in the Lord:"
51004008,"Whom I have sent unto you for the same purpose, that he might know your estate, and comfort your hearts;"
51004009,"With Onesimus, a faithful and beloved brother, who is one of you. They shall make known unto you all things which are done here."
51004010,"Aristarchus my fellowprisoner saluteth you, and Marcus, sister's son to Barnabas, (touching whom ye received commandments: if he come unto you, receive him;)"
51004011,"And Jesus, which is called Justus, who are of the circumcision. These only are my fellowworkers unto the kingdom of God, which have been a comfort unto me."
51004012,"Epaphras, who is one of you, a servant of Christ, saluteth you, always labouring fervently for you in prayers, that ye may stand perfect and complete in all the will of God."
51004013,"For I bear him record, that he hath a great zeal for you, and them that are in Laodicea, and them in Hierapolis."
51004014,"Luke, the beloved physician, and Demas, greet you."
51004015,"Salute the brethren which are in Laodicea, and Nymphas, and the church which is in his house."
51004016,"And when this epistle is read among you, cause that it be read also in the church of the Laodiceans; and that ye likewise read the epistle from Laodicea."
51004017,"And say to Archippus, Take heed to the ministry which thou hast received in the Lord, that thou fulfil it."
51004018,The salutation by the hand of me Paul. Remember my bonds. Grace be with you. Amen.
53001001,"Paul, and Silvanus, and Timotheus, unto the church of the Thessalonians in God our Father and the Lord Jesus Christ:"
53001002,"Grace unto you, and peace, from God our Father and the Lord Jesus Christ."
53001003,"We are bound to thank God always for you, brethren, as it is meet, because that your faith groweth exceedingly, and the charity of every one of you all toward each other aboundeth;"
53001004,So that we ourselves glory in you in the churches of God for your patience and faith in all your persecutions and tribulations that ye endure:
53001005,"Which is a manifest token of the righteous judgment of God, that ye may be counted worthy of the kingdom of God, for which ye also suffer:"
53001006,Seeing it is a righteous thing with God to recompense tribulation to them that trouble you;
53001007,"And to you who are troubled rest with us, when the Lord Jesus shall be revealed from heaven with his mighty angels,"
53001008,"In flaming fire taking vengeance on them that know not God, and that obey not the gospel of our Lord Jesus Christ:"
53001009,"Who shall be punished with everlasting destruction from the presence of the Lord, and from the glory of his power;"
53001010,"When he shall come to be glorified in his saints, and to be admired in all them that believe (because our testimony among you was believed) in that day."
53001011,"Wherefore also we pray always for you, that our God would count you worthy of this calling, and fulfil all the good pleasure of his goodness, and the work of faith with power:"
53001012,"That the name of our Lord Jesus Christ may be glorified in you, and ye in him, according to the grace of our God and the Lord Jesus Christ."
53002001,"Now we beseech you, brethren, by the coming of our Lord Jesus Christ, and by our gathering together unto him,"
53002002,"That ye be not soon shaken in mind, or be troubled, neither by spirit, nor by word, nor by letter as from us, as that the day of Christ is at hand."
53002003,"Let no man deceive you by any means: for that day shall not come, except there come a falling away first, and that man of sin be revealed, the son of perdition;"
53002004,"Who opposeth and exalteth himself above all that is called God, or that is worshipped; so that he as God sitteth in the temple of God, shewing himself that he is God."
53002005,"Remember ye not, that, when I was yet with you, I told you these things?"
53002006,And now ye know what withholdeth that he might be revealed in his time.
53002007,"For the mystery of iniquity doth already work: only he who now letteth will let, until he be taken out of the way."
53002008,"And then shall that Wicked be revealed, whom the Lord shall consume with the spirit of his mouth, and shall destroy with the brightness of his coming:"
53002009,"Even him, whose coming is after the working of Satan with all power and signs and lying wonders,"
53002010,"And with all deceivableness of unrighteousness in them that perish; because they received not the love of the truth, that they might be saved."
53002011,"And for this cause God shall send them strong delusion, that they should believe a lie:"
53002012,"That they all might be damned who believed not the truth, but had pleasure in unrighteousness."
53002013,"But we are bound to give thanks alway to God for you, brethren beloved of the Lord, because God hath from the beginning chosen you to salvation through sanctification of the Spirit and belief of the truth:"
53002014,"Whereunto he called you by our gospel, to the obtaining of the glory of our Lord Jesus Christ."
53002015,"Therefore, brethren, stand fast, and hold the traditions which ye have been taught, whether by word, or our epistle."
53002016,"Now our Lord Jesus Christ himself, and God, even our Father, which hath loved us, and hath given us everlasting consolation and good hope through grace,"
53002017,"Comfort your hearts, and stablish you in every good word and work."
53003001,"Finally, brethren, pray for us, that the word of the Lord may have free course, and be glorified, even as it is with you:"
53003002,And that we may be delivered from unreasonable and wicked men: for all men have not faith.
53003003,"But the Lord is faithful, who shall stablish you, and keep you from evil."
53003004,"And we have confidence in the Lord touching you, that ye both do and will do the things which we command you."
53003005,"And the Lord direct your hearts into the love of God, and into the patient waiting for Christ."
53003006,"Now we command you, brethren, in the name of our Lord Jesus Christ, that ye withdraw yourselves from every brother that walketh disorderly, and not after the tradition which he received of us."
53003007,For yourselves know how ye ought to follow us: for we behaved not ourselves disorderly among you;
53003008,"Neither did we eat any man's bread for nought; but wrought with labour and travail night and day, that we might not be chargeable to any of you:"
53003009,"Not because we have not power, but to make ourselves an ensample unto you to follow us."
53003010,"For even when we were with you, this we commanded you, that if any would not work, neither should he eat."
53003011,"For we hear that there are some which walk among you disorderly, working not at all, but are busybodies."
53003012,"Now them that are such we command and exhort by our Lord Jesus Christ, that with quietness they work, and eat their own bread."
53003013,"But ye, brethren, be not weary in well doing."
53003014,"And if any man obey not our word by this epistle, note that man, and have no company with him, that he may be ashamed."
53003015,"Yet count him not as an enemy, but admonish him as a brother."
53003016,Now the Lord of peace himself give you peace always by all means. The Lord be with you all.
53003017,"The salutation of Paul with mine own hand, which is the token in every epistle: so I write."
53003018,The grace of our Lord Jesus Christ be with you all. Amen.